{
  "schema_version": "1.0.0",
  "project": {
    "id": "campus_attendance_system",
    "name": "Campus Attendance System",
    "objective": "Initial project initialization for Campus Attendance System",
    "domain": "COLLEGE_STUDENT",
    "source_type": "idea"
  },
  "health": {
    "entropy": 0.4375,
    "health_score": 63.25,
    "metrics": {
      "requirements_total": 3,
      "requirements_proposed": 3,
      "decisions_total": 1,
      "decisions_unapproved": 1,
      "assumptions_active": 0,
      "assumptions_weak": 0,
      "unknowns_open": 3,
      "unknowns_high_impact": 1,
      "conflicts_open": 0,
      "average_confidence": 0.9
    },
    "recommendations": [
      "Resolve 1 high-impact Unknown(s) in questioning.",
      "Review and approve proposed requirements.",
      "Sign off on 1 unapproved/proposed architectural decision(s)."
    ]
  },
  "requirements": [
    {
      "id": "R-101_campus_attendance_system",
      "title": "User Authentication",
      "description": "the System shall authenticate registered users using secure credentials before granting access to workflows.",
      "ears_pattern": "UBIQUITOUS",
      "priority": "CRITICAL",
      "status": "PROPOSED",
      "category": "FUNCTIONAL",
      "affected_components": [
        "Frontend Web & Mobile App",
        "REST API Backend",
        "Role-Based Authentication Service"
      ],
      "constraints": [
        "Passwords must be hashed using bcrypt or Argon2",
        "Tokens must expire after 24 hours"
      ],
      "acceptance_criteria": [
        "Valid credentials successfully generate access tokens",
        "Invalid credentials reject with HTTP 401 Unauthorized"
      ]
    },
    {
      "id": "R-102_campus_attendance_system",
      "title": "Core Domain Action Execution",
      "description": "WHEN an authorized user submits a record or action request, the System shall record and store the operational log with UTC timestamp and actor identity.",
      "ears_pattern": "EVENT_DRIVEN",
      "priority": "HIGH",
      "status": "PROPOSED",
      "category": "FUNCTIONAL",
      "affected_components": [
        "REST API Backend",
        "Relational Database"
      ],
      "constraints": [],
      "acceptance_criteria": [
        "Submitted actions are committed with immutable audit timestamp",
        "Unauthorized submissions return HTTP 403 Forbidden"
      ]
    },
    {
      "id": "R-103_campus_attendance_system",
      "title": "Network Disconnection / Fault Handling",
      "description": "IF the network connection is lost during data submission, THEN the System shall queue pending local transactions and display a non-blocking offline alert.",
      "ears_pattern": "UNWANTED_BEHAVIOR",
      "priority": "MEDIUM",
      "status": "PROPOSED",
      "category": "FUNCTIONAL",
      "affected_components": [
        "Frontend Web & Mobile App"
      ],
      "constraints": [],
      "acceptance_criteria": [
        "Network interruption triggers offline queueing",
        "Reconnection synchronizes queued records to the backend"
      ]
    }
  ],
  "decisions": [
    {
      "id": "D-001_campus_attendance_system",
      "title": "Database Engine",
      "decision": "SQLite / PostgreSQL",
      "reason": "ACID transactional safety for attendance and grade records",
      "rejected_alternatives": [
        {
          "alternative": "MongoDB",
          "reason_rejected": "Lack of relational integrity for enrollment",
          "proposed_by": null
        }
      ],
      "status": "PROPOSED",
      "approval_level": "USER",
      "change_risk": "MEDIUM",
      "superseded_by": null
    }
  ],
  "assumptions": [],
  "unknowns": [
    {
      "id": "UNK-001_campus_attendance_system",
      "question": "What is the deployment environment? (Local demo, university intranet, or public cloud)?",
      "impact": "HIGH",
      "category": "ARCHITECTURE",
      "status": "OPEN",
      "resolution": null
    },
    {
      "id": "UNK-002_campus_attendance_system",
      "question": "What authentication method should be used? (Email/password, College SSO/SAML, or Roll Number/PIN)?",
      "impact": "MEDIUM",
      "category": "SECURITY",
      "status": "OPEN",
      "resolution": null
    },
    {
      "id": "UNK-003_campus_attendance_system",
      "question": "Does attendance verification require QR codes, Geofencing, or Manual faculty entry?",
      "impact": "MEDIUM",
      "category": "SECURITY",
      "status": "OPEN",
      "resolution": null
    }
  ],
  "components": [
    {
      "id": "COMP-API_campus_attendance_system",
      "name": "REST API Backend",
      "component_type": "BACKEND",
      "description": "",
      "stability_state": "PROPOSED",
      "blast_radius": []
    },
    {
      "id": "COMP-AUTH_campus_attendance_system",
      "name": "Role-Based Authentication Service",
      "component_type": "AUTH",
      "description": "",
      "stability_state": "PROPOSED",
      "blast_radius": []
    },
    {
      "id": "COMP-DB_campus_attendance_system",
      "name": "Relational Database",
      "component_type": "DATABASE",
      "description": "",
      "stability_state": "PROPOSED",
      "blast_radius": []
    },
    {
      "id": "COMP-UI_campus_attendance_system",
      "name": "Frontend Web & Mobile App",
      "component_type": "FRONTEND",
      "description": "",
      "stability_state": "PROPOSED",
      "blast_radius": []
    }
  ],
  "contracts": [],
  "conflicts": [],
  "discovery_audit": [
    {
      "id": "AUD-001_campus_attendance_system",
      "silent_assumption": "Multi-tenancy across different universities is not required in MVP",
      "reason_skipped": "Standard college project scope is single institution",
      "risk_level": "LOW",
      "category": "DOMAIN_DEFAULT"
    },
    {
      "id": "AUD-002_campus_attendance_system",
      "silent_assumption": "English is the primary interface language",
      "reason_skipped": "Default for college management software unless specified",
      "risk_level": "LOW",
      "category": "DOMAIN_DEFAULT"
    }
  ]
}